{
  "approved": true,
  "property_id": "FURAMA_DANANG",
  "effective_from": "2026-01-01",
  "effective_to": "2030-01-01",
  "source_id": "kb_property_furama_resort_danang",
  "source_revisions": {
    "vi": "6f7bdb21bb400052f6ab827f",
    "en": "41daa5d2d6269e994d3784fc",
    "zh": "7d76d2cc3a500a9b8ffa20ad",
    "ko": "64b4172966044b6d82a94cf5"
  },
  "origin": "property_furama_resort_danang",
  "places": [
    {
      "id": "zone_main_lobby",
      "place_type": "zone_hub",
      "zone_hub_id": "zone_main_lobby",
      "aliases": [
        "Main Building & Lobby",
        "zone.main_lobby",
        "Tòa nhà chính & Sảnh",
        "메인 빌딩 & 로비",
        "主楼与大堂"
      ],
      "labels": {
        "vi": "Tòa nhà chính & Sảnh",
        "en": "Main Building & Lobby",
        "zh": "主楼与大堂",
        "ko": "메인 빌딩 & 로비"
      }
    },
    {
      "id": "property_furama_resort_danang",
      "place_type": "entity",
      "zone_hub_id": "zone_main_lobby",
      "aliases": [
        "Front Desk & Cashier",
        "Furama Resort Danang",
        "property.furama_resort_danang",
        "Khu nghỉ dưỡng Furama Đà Nẵng",
        "푸라마 리조트 다낭",
        "岘港富丽华度假村",
        "wifi",
        "와이파이",
        "无线网络",
        "wi-fi",
        "미니바",
        "迷你吧",
        "minibar",
        "레이트 체크아웃",
        "延迟退房",
        "late checkout",
        "trả phòng muộn",
        "체크아웃 시간",
        "退房时间",
        "check out late"
      ],
      "labels": {
        "vi": "Khu nghỉ dưỡng Furama Đà Nẵng",
        "en": "Furama Resort Danang",
        "zh": "岘港富丽华度假村",
        "ko": "푸라마 리조트 다낭"
      }
    },
    {
      "id": "service_concierge",
      "place_type": "entity",
      "zone_hub_id": "zone_main_lobby",
      "aliases": [
        "Concierge Desk",
        "service.concierge",
        "Quầy Concierge",
        "컨시어지 데스크",
        "礼宾部"
      ],
      "labels": {
        "vi": "Quầy Concierge",
        "en": "Concierge Desk",
        "zh": "礼宾部",
        "ko": "컨시어지 데스크"
      }
    },
    {
      "id": "bar_hai_van_lounge",
      "place_type": "entity",
      "zone_hub_id": "zone_main_lobby",
      "aliases": [
        "Hải Vân Lounge",
        "bar.hai_van_lounge",
        "하이반 라운지",
        "海云酒廊"
      ],
      "labels": {
        "vi": "Hải Vân Lounge",
        "en": "Hải Vân Lounge",
        "zh": "海云酒廊",
        "ko": "하이반 라운지"
      }
    },
    {
      "id": "meeting_boardroom",
      "place_type": "entity",
      "zone_hub_id": "zone_main_lobby",
      "aliases": [
        "Boardroom",
        "meeting.boardroom",
        "Phòng họp Boardroom",
        "이사회실",
        "董事会议室"
      ],
      "labels": {
        "vi": "Phòng họp Boardroom",
        "en": "Boardroom",
        "zh": "董事会议室",
        "ko": "이사회실"
      }
    },
    {
      "id": "meeting_gallery",
      "place_type": "entity",
      "zone_hub_id": "zone_main_lobby",
      "aliases": [
        "The Gallery",
        "meeting.gallery",
        "Phòng Gallery",
        "갤러리",
        "画廊厅"
      ],
      "labels": {
        "vi": "Phòng Gallery",
        "en": "The Gallery",
        "zh": "画廊厅",
        "ko": "갤러리"
      }
    },
    {
      "id": "meeting_ocean_ballroom",
      "place_type": "entity",
      "zone_hub_id": "zone_main_lobby",
      "aliases": [
        "Ocean Ballroom",
        "meeting.ocean_ballroom",
        "오션 볼룸",
        "海洋宴会厅"
      ],
      "labels": {
        "vi": "Ocean Ballroom",
        "en": "Ocean Ballroom",
        "zh": "海洋宴会厅",
        "ko": "오션 볼룸"
      }
    },
    {
      "id": "zone_ocean_wing",
      "place_type": "zone_hub",
      "zone_hub_id": "zone_ocean_wing",
      "aliases": [
        "Ocean Wing Guest Accommodations",
        "zone.ocean_wing",
        "Ocean Wing Guest Rooms",
        "Khu phòng Ocean Wing",
        "오션 윙 객실 구역",
        "海景翼客房区"
      ],
      "labels": {
        "vi": "Khu phòng Ocean Wing",
        "en": "Ocean Wing Guest Rooms",
        "zh": "海景翼客房区",
        "ko": "오션 윙 객실 구역"
      }
    },
    {
      "id": "room_ocean_deluxe",
      "place_type": "entity",
      "zone_hub_id": "zone_ocean_wing",
      "aliases": [
        "Ocean Deluxe Rooms",
        "Ocean Deluxe",
        "room.ocean_deluxe",
        "Phòng Ocean Deluxe",
        "오션 디럭스",
        "海景豪华房"
      ],
      "labels": {
        "vi": "Phòng Ocean Deluxe",
        "en": "Ocean Deluxe",
        "zh": "海景豪华房",
        "ko": "오션 디럭스"
      }
    },
    {
      "id": "room_ocean_studio_suite",
      "place_type": "entity",
      "zone_hub_id": "zone_ocean_wing",
      "aliases": [
        "Ocean Studio Suites",
        "Ocean Studio Suite",
        "room.ocean_studio_suite",
        "Phòng Ocean Studio Suite",
        "오션 스튜디오 스위트",
        "海景单间套房"
      ],
      "labels": {
        "vi": "Phòng Ocean Studio Suite",
        "en": "Ocean Studio Suite",
        "zh": "海景单间套房",
        "ko": "오션 스튜디오 스위트"
      }
    },
    {
      "id": "room_ocean_suite",
      "place_type": "entity",
      "zone_hub_id": "zone_ocean_wing",
      "aliases": [
        "Ocean Suites",
        "Ocean Suite",
        "room.ocean_suite",
        "Phòng Ocean Suite",
        "오션 스위트",
        "海景套房"
      ],
      "labels": {
        "vi": "Phòng Ocean Suite",
        "en": "Ocean Suite",
        "zh": "海景套房",
        "ko": "오션 스위트"
      }
    },
    {
      "id": "room_presidential_suite",
      "place_type": "entity",
      "zone_hub_id": "zone_ocean_wing",
      "aliases": [
        "Presidential Suite",
        "room.presidential_suite",
        "Phòng Tổng Thống",
        "프레지덴셜 스위트",
        "总统套房"
      ],
      "labels": {
        "vi": "Phòng Tổng Thống",
        "en": "Presidential Suite",
        "zh": "总统套房",
        "ko": "프레지덴셜 스위트"
      }
    },
    {
      "id": "zone_garden_wing",
      "place_type": "zone_hub",
      "zone_hub_id": "zone_garden_wing",
      "aliases": [
        "Garden & Lagoon Wing Guest Accommodations",
        "zone.garden_wing",
        "Garden & Lagoon Wing Guest Rooms",
        "Khu phòng Garden & Lagoon Wing",
        "가든 & 라군 윙 객실 구역",
        "花园与泻湖翼客房区"
      ],
      "labels": {
        "vi": "Khu phòng Garden & Lagoon Wing",
        "en": "Garden & Lagoon Wing Guest Rooms",
        "zh": "花园与泻湖翼客房区",
        "ko": "가든 & 라군 윙 객실 구역"
      }
    },
    {
      "id": "room_garden_superior",
      "place_type": "entity",
      "zone_hub_id": "zone_garden_wing",
      "aliases": [
        "Garden Superior Rooms",
        "Garden Superior",
        "room.garden_superior",
        "Phòng Garden Superior",
        "가든 수페리어",
        "花园高级房"
      ],
      "labels": {
        "vi": "Phòng Garden Superior",
        "en": "Garden Superior",
        "zh": "花园高级房",
        "ko": "가든 수페리어"
      }
    },
    {
      "id": "room_garden_deluxe",
      "place_type": "entity",
      "zone_hub_id": "zone_garden_wing",
      "aliases": [
        "Garden Deluxe Rooms",
        "Garden Deluxe",
        "room.garden_deluxe",
        "Phòng Garden Deluxe",
        "가든 디럭스",
        "花园豪华房"
      ],
      "labels": {
        "vi": "Phòng Garden Deluxe",
        "en": "Garden Deluxe",
        "zh": "花园豪华房",
        "ko": "가든 디럭스"
      }
    },
    {
      "id": "room_lagoon_superior",
      "place_type": "entity",
      "zone_hub_id": "zone_garden_wing",
      "aliases": [
        "Lagoon Superior Rooms",
        "Lagoon Superior",
        "room.lagoon_superior",
        "Phòng Lagoon Superior",
        "라군 수페리어",
        "环礁湖高级房"
      ],
      "labels": {
        "vi": "Phòng Lagoon Superior",
        "en": "Lagoon Superior",
        "zh": "环礁湖高级房",
        "ko": "라군 수페리어"
      }
    },
    {
      "id": "zone_villas",
      "place_type": "zone_hub",
      "zone_hub_id": "zone_villas",
      "aliases": [
        "Furama Villas Enclave",
        "zone.villas",
        "Furama Villas",
        "Khu biệt thự Furama",
        "푸라마 빌라 구역",
        "富丽华别墅区"
      ],
      "labels": {
        "vi": "Khu biệt thự Furama",
        "en": "Furama Villas",
        "zh": "富丽华别墅区",
        "ko": "푸라마 빌라 구역"
      }
    },
    {
      "id": "room_pool_villas",
      "place_type": "entity",
      "zone_hub_id": "zone_villas",
      "aliases": [
        "Pool Villas",
        "room.pool_villas",
        "Biệt thự có hồ bơi",
        "풀 빌라",
        "泳池别墅"
      ],
      "labels": {
        "vi": "Biệt thự có hồ bơi",
        "en": "Pool Villas",
        "zh": "泳池别墅",
        "ko": "풀 빌라"
      }
    },
    {
      "id": "room_beach_front_villas",
      "place_type": "entity",
      "zone_hub_id": "zone_villas",
      "aliases": [
        "Beachfront Villas",
        "room.beach_front_villas",
        "Biệt thự trước biển",
        "비치프론트 빌라",
        "海滨别墅"
      ],
      "labels": {
        "vi": "Biệt thự trước biển",
        "en": "Beachfront Villas",
        "zh": "海滨别墅",
        "ko": "비치프론트 빌라"
      }
    },
    {
      "id": "contact_butler_service",
      "place_type": "entity",
      "zone_hub_id": "zone_villas",
      "aliases": [
        "Villa Butler Desk",
        "Butler Service",
        "contact.butler_service",
        "Dịch vụ Quản gia",
        "버틀러 서비스",
        "管家服务",
        "butler",
        "quản gia",
        "버틀러",
        "管家",
        "villa butler",
        "quản gia biệt thự",
        "빌라 버틀러",
        "别墅管家",
        "butler hotline",
        "hotline quản gia",
        "전담 버틀러",
        "私人管家",
        "private butler"
      ],
      "labels": {
        "vi": "Dịch vụ Quản gia",
        "en": "Butler Service",
        "zh": "管家服务",
        "ko": "버틀러 서비스"
      }
    },
    {
      "id": "zone_dining_hub",
      "place_type": "zone_hub",
      "zone_hub_id": "zone_dining_hub",
      "aliases": [
        "Dining & Culinary Venues",
        "zone.dining_hub",
        "Dining & Culinary Area",
        "Khu ẩm thực & nhà hàng",
        "다이닝 & 레스토랑 구역",
        "餐饮与餐厅区域"
      ],
      "labels": {
        "vi": "Khu ẩm thực & nhà hàng",
        "en": "Dining & Culinary Area",
        "zh": "餐饮与餐厅区域",